84,8429,842952,Break-Bulk,General Cargo,Vehicles & Machinery,Vehicles & Machine,MACHINERY,0,10000,KEEP,"Self-propelled bulldozers, angledozers, graders, levelers, scrapers, mechanical shovels, excavators, shovel loaders, tamping machines and road rollers:","Self-propelled bulldozers, angledozers, graders, levelers, scrapers, mechanical shovels, excavators, shovel loaders, tamping machines and road rollers:",,,,1,1,MACHINERY
84,8430,843041,Break-Bulk,General Cargo,Vehicles & Machinery,Vehicles & Machine,MACHINERY,0,10000,KEEP,"Other moving, grading, leveling, scraping, excavating, tamping, compacting, extracting or boring machinery, for earth, minerals or ores; pile-drivers and pile-extractors; snowplows and snowblowers:","Other moving, grading, leveling, scraping, excavating, tamping, compacting, extracting or boring machinery, for earth, minerals or ores; pile-drivers and pile-extractors; snowplows and snowblowers:",,,,1,1,MACHINERY
84,8431,843149,Break-Bulk,General Cargo,Vehicles & Machinery,Vehicles & Machine,MACHINERY,0,10000,KEEP,Parts suitable for use solely or principally with the machinery of headings 8425 to 8430:,Parts suitable for use solely or principally with the machinery of headings 8425 to 8430:,,,,1,1,MACHINERY
84,8432,843239,Break-Bulk,General Cargo,Vehicles & Machinery,Vehicles & Machine,MACHINERY,0,10000,KEEP,"Agricultural, horticultural or forestry machinery for soil preparation or cultivation; lawn or sports ground rollers; parts thereof:","Agricultural, horticultural or forestry machinery for soil preparation or cultivation; lawn or sports ground rollers; parts thereof:",,,,1,1,MACHINERY
84,8433,843351,Break-Bulk,General Cargo,Vehicles & Machinery,Vehicles & Machine,MACHINERY,0,10000,KEEP,"Harvesting or threshing machinery, including straw or fodder balers; grass or hay mowers; machines for cleaning, sorting or grading eggs, fruit or other agricultural produce, other than machinery of heading 8437; parts thereof:","Harvesting or threshing machinery, including straw or fodder balers; grass or hay mowers; machines for cleaning, sorting or grading eggs, fruit or other agricultural produce, other than machinery of heading 8437; parts thereof:",,,,1,1,MACHINERY
84,8436,843680,Break-Bulk,General Cargo,Vehicles & Machinery,Vehicles & Machine,MACHINERY,0,10000,KEEP,"Other agricultural, horticultural, forestry, poultry-keeping or bee-keeping machinery, including germination plant fitted with mechanical or thermal equipment; poultry incubators and brooders; parts thereof:","Other agricultural, horticultural, forestry, poultry-keeping or bee-keeping machinery, including germination plant fitted with mechanical or thermal equipment; poultry incubators and brooders; parts thereof:",,,,1,1,MACHINERY
84,8437,843702,Break-Bulk,General Cargo,Vehicles & Machinery,Vehicles & Machine,MACHINERY,0,10000,KEEP,"Machines for cleaning, sorting or grading seed, grain or dried leguminous vegetables, and parts thereof; machinery used in the milling industry or for the working of cereals or dried leguminous vegetables, other than farm type machinery; parts thereof:","Machines for cleaning, sorting or grading seed, grain or dried leguminous vegetables, and parts thereof; machinery used in the milling industry or for the working of cereals or dried leguminous vegetables, other than farm type machinery; parts thereof:",,,,1,1,MACHINERY
84,8438,843850,Break-Bulk,General Cargo,Vehicles & Machinery,Vehicles & Machine,MACHINERY,0,10000,KEEP,"Machinery, not specified or included elsewhere in this chapter, for the industrial preparation or manufacture of food or drink, other than machinery for the extraction or preparation of animal or fixed vegetable or microbial fats or oils; parts thereof:","Machinery, not specified or included elsewhere in this chapter, for the industrial preparation or manufacture of food or drink, other than machinery for the extraction or preparation of animal or fixed vegetable or microbial fats or oils; parts thereof:",,,,1,1,MACHINERY
84,8439,843999,Break-Bulk,General Cargo,Vehicles & Machinery,Vehicles & Machine,MACHINERY,0,10000,KEEP,Machinery for making pulp of fibrous cellulosic material or for making or finishing paper or paperboard (other than the machinery of heading 8419); parts thereof:,Machinery for making pulp of fibrous cellulosic material or for making or finishing paper or paperboard (other than the machinery of heading 8419); parts thereof:,,,,1,1,MACHINERY
84,8441,844120,Break-Bulk,General Cargo,Vehicles & Machinery,Vehicles & Machine,MACHINERY,0,10000,KEEP,"Other machinery for making up paper pulp, paper or paperboard, including cutting machines of all kinds, and parts thereof:","Other machinery for making up paper pulp, paper or paperboard, including cutting machines of all kinds, and parts thereof:",,,,1,1,MACHINERY
84,8442,844208,Break-Bulk,General Cargo,Vehicles & Machinery,Vehicles & Machine,MACHINERY,0,10000,KEEP,"Machinery, apparatus and equipment (other than the machines of headings 8456 to 8465), for preparing or making plates, cylinders or other printing components; plates, cylinders and other printing components; plates, cylinders and lithographic stones, prepared for printing purposes (for example, planed, grained or polished); parts thereof:","Machinery, apparatus and equipment (other than the machines of headings 8456 to 8465), for preparing or making plates, cylinders or other printing components; plates, cylinders and other printing components; plates, cylinders and lithographic stones, prepared for printing purposes (for example, planed, grained or polished); parts thereof:",,,,1,1,MACHINERY
84,8443,844316,Break-Bulk,General Cargo,Vehicles & Machinery,Vehicles & Machine,MACHINERY,0,10000,KEEP,"Printing machinery used for printing by means of plates, cylinders and other printing components of heading 8442; other printers, copying machines and facsimile machines, whether or not combined; parts and accessories thereof:","Printing machinery used for printing by means of plates, cylinders and other printing components of heading 8442; other printers, copying machines and facsimile machines, whether or not combined; parts and accessories thereof:",,,,1,1,MACHINERY
84,8444,084445,Break-Bulk,General Cargo,Vehicles & Machinery,Vehicles & Machine,MACHINERY,0,10000,KEEP,"Machines for extruding, drawing, texturing or cutting man-made textile materials","Machines for extruding, drawing, texturing or cutting man-made textile materials",,,,1,1,MACHINERY
84,8445,084455,Break-Bulk,General Cargo,Vehicles & Machinery,Vehicles & Machine,MACHINERY,0,10000,KEEP,"Machines for preparing textile fibers; spinning, doubling or twisting machines and other machinery for producing textile yarns; textile reeling or winding (including weft winding) machines and machines for preparing textile yarns for use on the machines of heading 8446 or 8447:","Machines for preparing textile fibers; spinning, doubling or twisting machines and other machinery for producing textile yarns; textile reeling or winding (including weft winding) machines and machines for preparing textile yarns for use on the machines of heading 8446 or 8447:",,,,1,1,MACHINERY
84,8447,008447,Break-Bulk,General Cargo,Vehicles & Machinery,Vehicles & Machine,MACHINERY,0,10000,KEEP,"Knitting machines, stitch-bonding machines and machines for making gimped yarn, tulle, lace, embroidery, trimmings, braid or net and machines for tufting:","Knitting machines, stitch-bonding machines and machines for making gimped yarn, tulle, lace, embroidery, trimmings, braid or net and machines for tufting:",,,,1,1,MACHINERY
84,8448,844844,Break-Bulk,General Cargo,Vehicles & Machinery,Vehicles & Machine,MACHINERY,0,10000,KEEP,"Auxiliary machinery for use with machines of heading 8444, 8445, 8446 or 8447 (for example, dobbies, Jacquards, automatic stop motions and shuttle changing mechanisms); parts and accessories suitable for use solely or principally with the machines of this heading or of heading 8444, 8445, 8446 or 8447 (for example, spindles and spindle flyers, card clothing, combs, extruding nipples, shuttles, healds and heald-frames, hosiery needles):","Auxiliary machinery for use with machines of heading 8444, 8445, 8446 or 8447 (for example, dobbies, Jacquards, automatic stop motions and shuttle changing mechanisms); parts and accessories suitable for use solely or principally with the machines of this heading or of heading 8444, 8445, 8446 or 8447 (for example, spindles and spindle flyers, card clothing, combs, extruding nipples, shuttles, healds and heald-frames, hosiery needles):",,,,1,1,MACHINERY
84,8449,844900,Break-Bulk,General Cargo,Vehicles & Machinery,Vehicles & Machine,MACHINERY,0,10000,KEEP,"Machinery for the manufacture or finishing of felt or nonwovens in the piece or in shapes, including machinery for making felt hats",blocks for making hats,,,,1,1,MACHINERY
84,8450,084500,Break-Bulk,General Cargo,Vehicles & Machinery,Vehicles & Machine,MACHINERY,0,10000,KEEP,"Household- or laundry-type washing machines, including machines which both wash and dry; parts thereof:","Household- or laundry-type washing machines, including machines which both wash and dry; parts thereof:",,,,1,1,MACHINERY
84,8451,845140,Break-Bulk,General Cargo,Vehicles & Machinery,Vehicles & Machine,MACHINERY,0,10000,KEEP,"Machinery (other than machines of heading 8450) for washing, cleaning, wringing, drying, ironing, pressing (including fusing presses), bleaching, dyeing, dressing, finishing, coating or impregnating textile yarns, fabrics or made up textile articles and machines for applying the paste to the base fabric or other support used in the manufacture of floor coverings such as linoleum; machines for reeling, unreeling, folding, cutting or pinking textile fabrics; parts thereof:","Machinery (other than machines of heading 8450) for washing, cleaning, wringing, drying, ironing, pressing (including fusing presses), bleaching, dyeing, dressing, finishing, coating or impregnating textile yarns, fabrics or made up textile articles and machines for applying the paste to the base fabric or other support used in the manufacture of floor coverings such as linoleum; machines for reeling, unreeling, folding, cutting or pinking textile fabrics; parts thereof:",,,,1,1,MACHINERY
84,8454,845430,Break-Bulk,General Cargo,Vehicles & Machinery,Vehicles & Machine,MACHINERY,0,10000,KEEP,"Converters, ladles, ingot molds and casting machines, of a kind used in metallurgy or in metal foundries, and parts thereof:","Converters, ladles, ingot molds and casting machines, of a kind used in metallurgy or in metal foundries, and parts thereof:",,,,1,1,MACHINERY
84,8455,845590,Break-Bulk,General Cargo,Vehicles & Machinery,Vehicles & Machine,MACHINERY,0,10000,KEEP,Metal-rolling mills and rolls therefor; parts thereof:,Metal-rolling mills and rolls therefor; parts thereof:,,,,1,1,MACHINERY
84,8456,845630,Break-Bulk,General Cargo,Vehicles & Machinery,Vehicles & Machine,MACHINERY,0,10000,KEEP,"Machine tools for working any material by removal of material, by laser or other light or photon beam, ultrasonic, electro-discharge, electro-chemical, electron-beam, ionic-beam or plasma arc processes; water-jet cutting machines:","Machine tools for working any material by removal of material, by laser or other light or photon beam, ultrasonic, electro-discharge, electro-chemical, electron-beam, ionic-beam or plasma arc processes; water-jet cutting machines:",,,,1,1,MACHINERY
84,8457,845710,Break-Bulk,General Cargo,Vehicles & Machinery,Vehicles & Machine,MACHINERY,0,10000,KEEP,"Machining centers, unit construction machines (single station) and multistation transfer machines, for working metal:","Machining centers, unit construction machines (single station) and multistation transfer machines, for working metal:",,,,1,1,MACHINERY
84,8458,845845,Break-Bulk,General Cargo,Vehicles & Machinery,Vehicles & Machine,MACHINERY,0,10000,KEEP,Lathes (including turning centers) for removing metal:,Lathes (including turning centers) for removing metal:,,,,1,1,MACHINERY
84,8459,845921,Break-Bulk,General Cargo,Vehicles & Machinery,Vehicles & Machine,MACHINERY,0,10000,KEEP,"Machine tools (including way-type unit head machines) for drilling, boring, milling, threading or tapping by removing metal, other than lathes (including turning centers) of heading 8458:","Machine tools (including way-type unit head machines) for drilling, boring, milling, threading or tapping by removing metal, other than lathes (including turning centers) of heading 8458:",,,,1,1,MACHINERY
84,8460,846011,Break-Bulk,General Cargo,Vehicles & Machinery,Vehicles & Machine,MACHINERY,0,10000,KEEP,"Machine tools for deburring, sharpening, grinding, honing, lapping, polishing or otherwise finishing metal or cermets by means of grinding stones, abrasives or polishing products, other than gear cutting, gear grinding or gear finishing machines of heading 8461:","Machine tools for deburring, sharpening, grinding, honing, lapping, polishing or otherwise finishing metal or cermets by means of grinding stones, abrasives or polishing products, other than gear cutting, gear grinding or gear finishing machines of heading 8461:",,,,1,1,MACHINERY
84,8461,846150,Break-Bulk,General Cargo,Vehicles & Machinery,Vehicles & Machine,MACHINERY,0,10000,KEEP,"Machine tools for planing, shaping, slotting, broaching, gear cutting, gear grinding or gear finishing, sawing, cutting-off and other machine tools working by removing metal or cermets, not elsewhere specified or included:","Machine tools for planing, shaping, slotting, broaching, gear cutting, gear grinding or gear finishing, sawing, cutting-off and other machine tools working by removing metal or cermets, not elsewhere specified or included:",,,,1,1,MACHINERY
84,8462,846229,Break-Bulk,General Cargo,Vehicles & Machinery,Vehicles & Machine,MACHINERY,0,10000,KEEP,"Machine tools (including presses) for working metal by forging, hammering or die forging (excluding rolling mills); machine tools (including presses, slitting lines and cut-to-length lines) for working metal by bending, folding, straightening, flattening, shearing, punching, notching or nibbling (excluding drawbenches); presses for working metal or metal carbides, not specified above:","Machine tools (including presses) for working metal by forging, hammering or die forging (excluding rolling mills); machine tools (including presses, slitting lines and cut-to-length lines) for working metal by bending, folding, straightening, flattening, shearing, punching, notching or nibbling (excluding drawbenches); presses for working metal or metal carbides, not specified above:",,,,1,1,MACHINERY
84,8463,846390,Break-Bulk,General Cargo,Vehicles & Machinery,Vehicles & Machine,MACHINERY,0,10000,KEEP,"Other machine tools for working metal or cermets, without removing material:","Other machine tools for working metal or cermets, without removing material:",,,,1,1,MACHINERY
84,8464,846490,Break-Bulk,General Cargo,Vehicles & Machinery,Vehicles & Machine,MACHINERY,0,10000,KEEP,"Machine tools for working stone, ceramics, concrete, asbestos-cement or like mineral materials or for cold working glass:","Machine tools for working stone, ceramics, concrete, asbestos-cement or like mineral materials or for cold working glass:",,,,1,1,MACHINERY
84,8465,846593,Break-Bulk,General Cargo,Vehicles & Machinery,Vehicles & Machine,MACHINERY,0,10000,KEEP,"Machine tools (including machines for nailing, stapling, glueing or otherwise assembling) for working wood, cork, bone, hard rubber, hard plastics or similar hard materials:","Machine tools (including machines for nailing, stapling, glueing or otherwise assembling) for working wood, cork, bone, hard rubber, hard plastics or similar hard materials:",,,,1,1,MACHINERY
84,8466,846693,Break-Bulk,General Cargo,Vehicles & Machinery,Vehicles & Machine,MACHINERY,0,10000,KEEP,"Parts and accessories suitable for use solely or principally with the machines of headings 8456 to 8465, including work or tool holders, self-opening dieheads, dividing heads and other special attachments for the machines; tool holders for any type of tool for working in the hand:","Parts and accessories suitable for use solely or principally with the machines of headings 8456 to 8465, including work or tool holders, self-opening dieheads, dividing heads and other special attachments for the machines; tool holders for any type of tool for working in the hand:",,,,1,1,MACHINERY
84,8467,846782,Break-Bulk,General Cargo,Vehicles & Machinery,Vehicles & Machine,MACHINERY,0,10000,KEEP,"Tools for working in the hand, pneumatic, hydraulic or with self-contained electric or nonelectric motor, and parts thereof:","Tools for working in the hand, pneumatic, hydraulic or with self-contained electric or nonelectric motor, and parts thereof:",,,,1,1,MACHINERY
84,8468,846890,Break-Bulk,General Cargo,Vehicles & Machinery,Vehicles & Machine,MACHINERY,0,10000,KEEP,"Machinery and apparatus for soldering, brazing or welding, whether or not capable of cutting, other than those of heading 8515; gas-operated surface tempering machines and appliances; parts thereof:","Machinery and apparatus for soldering, brazing or welding, whether or not capable of cutting, other than those of heading 8515; gas-operated surface tempering machines and appliances; parts thereof:",,,,1,1,MACHINERY
84,8470,847018,Break-Bulk,General Cargo,Vehicles & Machinery,Vehicles & Machine,MACHINERY,0,10000,KEEP,"Calculating machines and pocket-size data recording, reproducing and displaying machines with calculating functions; accounting machines, postage-franking machines, ticket-issuing machines and similar machines, incorporating a calculating device; cash registers:","Calculating machines and pocket-size data recording, reproducing and displaying machines with calculating functions; accounting machines, postage-franking machines, ticket-issuing machines and similar machines, incorporating a calculating device; cash registers:",,,,1,1,MACHINERY
84,8471,847141,Break-Bulk,General Cargo,Vehicles & Machinery,Vehicles & Machine,MACHINERY,0,10000,KEEP,"Automatic data processing machines and units thereof; magnetic or optical readers, machines for transcribing data onto data media in coded form and machines for processing such data, not elsewhere specified or included:","Automatic data processing machines and units thereof; magnetic or optical readers, machines for transcribing data onto data media in coded form and machines for processing such data, not elsewhere specified or included:",,,,1,1,MACHINERY
84,8472,847281,Break-Bulk,General Cargo,Vehicles & Machinery,Vehicles & Machine,MACHINERY,0,10000,KEEP,"Other office machines (for example, hectograph or stencil duplicating machines, addressing machines, automatic banknote dispensers, coin-sorting machines, coin-counting or wrapping machines, pencil-sharpening machines, perforating or stapling machines):","Other office machines (for example, hectograph or stencil duplicating machines, addressing machines, automatic banknote dispensers, coin-sorting machines, coin-counting or wrapping machines, pencil-sharpening machines, perforating or stapling machines):",,,,1,1,MACHINERY
84,8473,847304,Break-Bulk,General Cargo,Vehicles & Machinery,Vehicles & Machine,MACHINERY,0,10000,KEEP,"Parts and accessories (other than covers, carrying cases and the like) suitable for use solely or principally with machines of headings 8470 to 8472:","Parts and accessories (other than covers, carrying cases and the like) suitable for use solely or principally with machines of headings 8470 to 8472:",,,,1,1,MACHINERY
84,8474,847490,Break-Bulk,General Cargo,Vehicles & Machinery,Vehicles & Machine,MACHINERY,0,10000,KEEP,"Machinery for sorting, screening, separating, washing, crushing, grinding, mixing or kneading earth, stone, ores or other mineral substances, in solid (including powder or paste) form; machinery for agglomerating, shaping or molding solid mineral fuels, ceramic paste, unhardened cements, plastering materials or other mineral products in powder or paste form; machines for forming foundry molds of sand; parts thereof:","Machinery for sorting, screening, separating, washing, crushing, grinding, mixing or kneading earth, stone, ores or other mineral substances, in solid (including powder or paste) form; machinery for agglomerating, shaping or molding solid mineral fuels, ceramic paste, unhardened cements, plastering materials or other mineral products in powder or paste form; machines for forming foundry molds of sand; parts thereof:",,,,1,1,MACHINERY
84,8475,847500,Break-Bulk,General Cargo,Vehicles & Machinery,Vehicles & Machine,MACHINERY,0,10000,KEEP,"Machines for assembling electric or electronic lamps, tubes or flashbulbs, in glass envelopes; machines for manufacturing or hot working glass or glassware; parts thereof:","Machines for assembling electric or electronic lamps, tubes or flashbulbs, in glass envelopes; machines for manufacturing or hot working glass or glassware; parts thereof:",,,,1,1,MACHINERY
84,8477,847710,Break-Bulk,General Cargo,Vehicles & Machinery,Vehicles & Machine,MACHINERY,0,10000,KEEP,"Machinery for working rubber or plastics or for the manufacture of products from these materials, not specified or included elsewhere in this chapter; parts thereof:","Machinery for working rubber or plastics or for the manufacture of products from these materials, not specified or included elsewhere in this chapter; parts thereof:",,,,1,1,MACHINERY
84,8479,847989,Break-Bulk,General Cargo,Vehicles & Machinery,Vehicles & Machine,MACHINERY,0,10000,KEEP,"Machines and mechanical appliances having individual functions, not specified or included elsewhere in this chapter; parts thereof:","Machines and mechanical appliances having individual functions, not specified or included elsewhere in this chapter; parts thereof:",,,,1,1,MACHINERY
84,8480,848071,Break-Bulk,General Cargo,Vehicles & Machinery,Vehicles & Machine,MACHINERY,0,10000,KEEP,"Molding boxes for metal foundry; mold bases; molding patterns; molds for metal (other than ingot molds), metal carbides, glass, mineral materials, rubber or plastics:","Molding boxes for metal foundry; mold bases; molding patterns; molds for metal (other than ingot molds), metal carbides, glass, mineral materials, rubber or plastics:",,,,1,1,MACHINERY
84,8481,848180,Break-Bulk,General Cargo,Vehicles & Machinery,Vehicles & Machine,MACHINERY,0,10000,KEEP,"Taps, cocks, valves and similar appliances, for pipes, boiler shells, tanks, vats or the like, including pressure-reducing valves and thermostatically controlled valves; parts thereof:","Taps, cocks, valves and similar appliances, for pipes, boiler shells, tanks, vats or the like, including pressure-reducing valves and thermostatically controlled valves; parts thereof:",,,,1,1,MACHINERY
84,8482,848291,Break-Bulk,General Cargo,Vehicles & Machinery,Vehicles & Machine,MACHINERY,0,10000,KEEP,"Ball or roller bearings, and parts thereof:","Ball or roller bearings, and parts thereof:",,,,1,1,MACHINERY
84,8483,848340,Break-Bulk,General Cargo,Vehicles & Machinery,Vehicles & Machine,MACHINERY,0,10000,KEEP,"Transmission shafts (including camshafts and crankshafts) and cranks; bearing housings, housed bearings and plain shaft bearings; gears and gearing; ball or roller screws; gear boxes and other speed changers, including torque converters; flywheels and pulleys, including pulley blocks; clutches and shaft couplings (including universal joints); parts thereof:","Transmission shafts (including camshafts and crankshafts) and cranks; bearing housings, housed bearings and plain shaft bearings; gears and gearing; ball or roller screws; gear boxes and other speed changers, including torque converters; flywheels and pulleys, including pulley blocks; clutches and shaft couplings (including universal joints); parts thereof:",,,,1,1,MACHINERY
84,8484,008484,Break-Bulk,General Cargo,Vehicles & Machinery,Vehicles & Machine,MACHINERY,0,10000,KEEP,"Gaskets and similar joints of metal sheeting combined with other material or of two or more layers of metal; sets or assortments of gaskets and similar joints, dissimilar in composition, put up in pouches, envelopes or similar packings; mechanical seals:","Gaskets and similar joints of metal sheeting combined with other material or of two or more layers of metal; sets or assortments of gaskets and similar joints, dissimilar in composition, put up in pouches, envelopes or similar packings; mechanical seals:",,,,1,1,MACHINERY
84,8485,084856,Break-Bulk,General Cargo,Vehicles & Machinery,Vehicles & Machine,MACHINERY,0,10000,KEEP,Machines for additive manufacturing:,Machines for additive manufacturing:,,,,1,1,MACHINERY
84,8486,848620,Break-Bulk,General Cargo,Vehicles & Machinery,Vehicles & Machine,MACHINERY,0,10000,KEEP,"Machines and apparatus of a kind used solely or principally for the manufacture of semiconductor boules or wafers, semiconductor devices, electronic integrated circuits or flat panel displays; machines and apparatus specified in note 11(C) to this chapter; parts and accessories:","Machines and apparatus of a kind used solely or principally for the manufacture of semiconductor boules or wafers, semiconductor devices, electronic integrated circuits or flat panel displays; machines and apparatus specified in note 11(C) to this chapter; parts and accessories:",,,,1,1,MACHINERY
84,8487,848790,Break-Bulk,General Cargo,Vehicles & Machinery,Vehicles & Machine,MACHINERY,0,10000,KEEP,"Machinery parts, not containing electrical connectors, insulators, coils, contacts or other electrical features, and not specified or included elsewhere in this chapter:","Machinery parts, not containing electrical connectors, insulators, coils, contacts or other electrical features, and not specified or included elsewhere in this chapter:",,,,1,1,MACHINERY
