HS2,HS4,HS6,Group,Commodity,Cargo,Cargo_Detail,Keywords_Str,Min Tons,Max Tons,Note,HS Title,HS Decription,HS_Code,Port of Loading (F),Shipper,Count,Tons,Keywords_List
10,1001,100100,Dry Bulk,Agricultural Products,Grain,Wheat,WHEAT,,,KEEP,Wheat and meslin:,Wheat and meslin:,,,,1,1,WHEAT
10,1002,100224,Dry Bulk,Agricultural Products,Grain,Rye,RYE,,,KEEP,Rye:,Rye:,,,,1,1,RYE
10,1003,100310,Dry Bulk,Agricultural Products,Grain,Barley,BARLEY,,,KEEP,Barley:,Barley:,,,,1,1,BARLEY
10,1004,100427,Dry Bulk,Agricultural Products,Grain,Oats,OATS,,,KEEP,Oats:,Oats:,,,,1,1,OATS
10,1005,100535,Dry Bulk,Agricultural Products,Grain,Corn,CORN,,,KEEP,Corn (maize):,Corn (maize):,,,,1,1,CORN
10,1006,100627,Dry Bulk,Agricultural Products,Grain,Rice,RICE,,,KEEP,Rice:,Rice:,,,,1,1,RICE
10,1008,100850,Dry Bulk,Agricultural Products,Grain,Buckwheat,BUCKWHEAT,,,KEEP,"Buckwheat, millet and canary seeds; other cereals (including wild rice):","Buckwheat, millet and canary seeds; other cereals (including wild rice):",,,,1,1,BUCKWHEAT
11,1103,110350,Dry Bulk,Agricultural Products,Grain,Grain,PERLITE,,,KEEP,"Cereal groats, meal and pellets:","Cereal groats, meal and pellets:",,,,1,1,PERLITE
11,1104,110460,Dry Bulk,Agricultural Products,Grain,Grain,GRAINS,,,KEEP,"Cereal grains otherwise worked (for example, hulled, rolled, flaked, pearled, sliced or kibbled), except rice of heading 1006; germ of cereals, whole, rolled, flaked or ground:","Cereal grains otherwise worked (for example, hulled, rolled, flaked, pearled, sliced or kibbled), except rice of heading 1006; germ of cereals, whole, rolled, flaked or ground:",,,,1,1,GRAINS
11,1107,110710,Dry Bulk,Agricultural Products,grain,Grain,MALT,,,KEEP,"Malt, whether or not roasted:","Malt, whether or not roasted:",,,,1,1,MALT
12,1201,120120,Dry Bulk,Agricultural Products,Grain,Soybeans,"SOYBEAN, SOYBEANS",,,KEEP,"Soybeans, whether or not broken:","Soybeans, whether or not broken:",,,,1,1,SOYBEAN; SOYBEANS
17,1701,170113,Dry Bulk,Agricultural Products,Sugar,Sugar,"RAW CANE, SUGAR",,,KEEP,"Cane or beet sugar and chemically pure sucrose, in solid form:","Cane or beet sugar and chemically pure sucrose, in solid form:",,,,1,1,RAW CANE; SUGAR
17,1702,001702,Dry Bulk,Agricultural Products,Sugar,Sugar,"RAW CANE, SUGAR",,,KEEP,"Other sugars, including chemically pure lactose, maltose, glucose and fructose, in solid form; sugar syrups not containing added flavoring or coloring matter; artificial honey, whether or not mixed with natural honey; caramel:","Other sugars, including chemically pure lactose, maltose, glucose and fructose, in solid form; sugar syrups not containing added flavoring or coloring matter; artificial honey, whether or not mixed with natural honey; caramel:",,,,1,1,RAW CANE; SUGAR
17,1704,170481,Dry Bulk,Agricultural Products,Sugar,Sugar,"RAW CANE, SUGAR",,,KEEP,"Sugar confectionery (including white chocolate), not containing cocoa:","Sugar confectionery (including white chocolate), not containing cocoa:",,,,1,1,RAW CANE; SUGAR
18,1803,180330,Break-Bulk,Agricultural Products,Cocoa,Cocoa,COCOA,1.5,60000,KEEP,"Cocoa paste, whether or not defatted:","Cocoa paste, whether or not defatted:",,,,1,1,COCOA
18,1804,180481,Break-Bulk,Agricultural Products,Cocoa,Cocoa,COCOA,1.5,60000,KEEP,Cocoa,"butter, fat and oil",,,,1,1,COCOA
18,1805,018059,Break-Bulk,Agricultural Products,Cocoa,Cocoa,COCOA,1.5,60000,KEEP,Cocoa,"butter, fat and oil",,,,1,1,COCOA
18,1806,001806,Break-Bulk,Agricultural Products,Cocoa,Cocoa,COCOA,1.5,60000,KEEP,Chocolate and other food preparations containing cocoa:,Chocolate and other food preparations containing cocoa:,,,,1,1,COCOA
25,2501,250150,Dry Bulk,Minerals & Ores,Salt,Salt,SALT,,,KEEP,Salt (including table salt and denatured salt),pure sodium chloride whether or not in aqueous solution; sea water,Classified: 2501.00,"Walvis Bay, Namibia",Walvis Bay Salt Refiners,1,1,SALT
25,2502,250250,Dry Bulk,Ferrous Raw Materials,Iron Products,"Iron Ore, Iron Concentrates",IRON PYRITES,,,KEEP,Iron pyrites,unroasted,,,,1,1,IRON PYRITES
25,2503,250300,Dry Bulk,Misc Bulk,misc bulk commodities,QUANTITY PRILLED SULPHUR,"PRILLED, QUANTITY, SULPHUR",,,KEEP,Sulphur of all kinds,"other than sublimed, precipitated and colloidal sulphur",Classified: 2503.00,"Vancouver, BC, Canada",H.J. Baker Sulphur Canada Ulc,1,1,PRILLED; QUANTITY; SULPHUR
25,2504,002504,Dry Bulk,Minerals & Ores,tbn,carbon,GRAPHITE,,,KEEP,Natural graphite:,Natural graphite:,,,,1,1,GRAPHITE
25,2505,250560,Dry Bulk,Construction Materials,Aggregates,"Sand, Gravel, Stone, Pebbles, Limestone, Aggregates","AGGREGATES, GRAVEL, LIMESTONE, PEBBLES, SAND",,,KEEP,"Natural sands of all kinds, whether or not colored, other than metalbearing sands of chapter 26:","Natural sands of all kinds, whether or not colored, other than metalbearing sands of chapter 26:",,,,1,1,AGGREGATES; GRAVEL; LIMESTONE; PEBBLES; SAND
25,2506,002506,Dry Bulk,Minerals & Ores,Minerals,Quartz,QUARTZ,,,KEEP,"Quartz (other than natural sands); quartzite, whether or not roughly trimmed or merely cut, by sawing or otherwise, into blocks or slabs of a rectangular (including square) shape:","Quartz (other than natural sands); quartzite, whether or not roughly trimmed or merely cut, by sawing or otherwise, into blocks or slabs of a rectangular (including square) shape:",,,,1,1,QUARTZ
25,2507,250760,Dry Bulk,Minerals & Ores,Clay,Clay,"ANDALUSITE, CLAY, KAOLIN",,,KEEP,Kaolin and other kaolinic clays,whether or not calcined,,,,1,1,ANDALUSITE; CLAY; KAOLIN
25,2508,250850,Dry Bulk,Minerals & Ores,Clay,Clay,"ANDALUSITE, CLAY, KAOLIN",,,KEEP,"Other clays (not including expanded clays of heading 6806), andalusite, kyanite and sillimanite, whether or not calcined; mullite; chamotte or dinas earths:","Other clays (not including expanded clays of heading 6806), andalusite, kyanite and sillimanite, whether or not calcined; mullite; chamotte or dinas earths:",,,,1,1,ANDALUSITE; CLAY; KAOLIN
25,2510,251022,Dry Bulk,Fertilizer,Phospourouse Fetilizers,PhosRock,"PHOSPHATE, ROCK",,,KEEP,"Natural calcium phosphates, natural aluminum calcium phosphates and phosphatic chalk:","Natural calcium phosphates, natural aluminum calcium phosphates and phosphatic chalk:",Classified: 2510.20,"All Other Peru Ports, Peru",Compania Minera Miski Mayo Srl,1,1,PHOSPHATE; ROCK
25,2511,002511,Dry Bulk,Minerals & Ores,Barite,Barite,BARITE,,,KEEP,"Natural barium sulfate (barytes); natural barium carbonate (witherite), whether or not calcined, other than barium oxide of heading 2816:","Natural barium sulfate (barytes); natural barium carbonate (witherite), whether or not calcined, other than barium oxide of heading 2816:",,,,1,1,BARITE
25,2513,251380,Dry Bulk,Construction Materials,Pumice,Pumice,PUMICE,,,KEEP,"Pumice; emery; natural corundum, natural garnet and other natural abrasives, whether or not heat-treated:","Pumice; emery; natural corundum, natural garnet and other natural abrasives, whether or not heat-treated:",,,,1,1,PUMICE
25,2516,251611,Dry Bulk,Construction Materials,Aggregates,"Sand, Gravel, Stone, Pebbles, Limestone, Aggregates","AGGREGATES, GRAVEL, LIMESTONE, PEBBLES, SAND",,,KEEP,"Granite, porphyry, basalt, sandstone and other monumental or building stone, whether or not roughly trimmed or merely cut, by sawing or otherwise, into blocks or slabs of a rectangular (including square) shape:","Granite, porphyry, basalt, sandstone and other monumental or building stone, whether or not roughly trimmed or merely cut, by sawing or otherwise, into blocks or slabs of a rectangular (including square) shape:",,,,1,1,AGGREGATES; GRAVEL; LIMESTONE; PEBBLES; SAND
25,2517,251739,Dry Bulk,Construction Materials,Aggregates,"Sand, Gravel, Stone, Pebbles, Limestone, Aggregates","AGGREGATES, GRAVEL, LIMESTONE, PEBBLES, SAND",,,KEEP,"Pebbles, gravel, broken or crushed stone, of a kind commonly used for concrete aggregates, for road metalling, or for railway or other ballast; shingle and flint, whether or not heat-treated; macadam of slag, dross or similar industrial waste, whether or not incorporating the materials cited in the first part of the heading; tarred macadam; granules, chippings and powder, of stones of heading 2515 or 2516, whether or not heat-treated:","Pebbles, gravel, broken or crushed stone, of a kind commonly used for concrete aggregates, for road metalling, or for railway or other ballast; shingle and flint, whether or not heat-treated; macadam of slag, dross or similar industrial waste, whether or not incorporating the materials cited in the first part of the heading; tarred macadam; granules, chippings and powder, of stones of heading 2515 or 2516, whether or not heat-treated:",,,,1,1,AGGREGATES; GRAVEL; LIMESTONE; PEBBLES; SAND
25,2518,251850,Dry Bulk,Minerals & Ores,Minerals,Dolomite,DOLOMITE,,,KEEP,"Dolomite, whether or not calcined or sintered, including dolomite roughly trimmed or merely cut, by sawing or otherwise, into blocks or slabs of a rectangular (including square) shape:","Dolomite, whether or not calcined or sintered, including dolomite roughly trimmed or merely cut, by sawing or otherwise, into blocks or slabs of a rectangular (including square) shape:",,,,1,1,DOLOMITE
25,2519,251998,Dry Bulk,Minerals & Ores,"Magnesia, Magnesite","Magnesia, Magnesite","MAGNESITE, MAGNESIUM OXIDE, SINTERMAG",,,KEEP,"Natural magnesium carbonate (magnesite); fused magnesia; dead-burned (sintered) magnesia, whether or not containing small quantities of other oxides added before sintering; other magnesium oxide, whether or not pure:","Natural magnesium carbonate (magnesite); fused magnesia; dead-burned (sintered) magnesia, whether or not containing small quantities of other oxides added before sintering; other magnesium oxide, whether or not pure:",,,,1,1,MAGNESITE; MAGNESIUM OXIDE; SINTERMAG
25,2520,252025,Dry Bulk,Construction Materials,Gypsum,Gypsum,GYPSUM,,,KEEP,"Gypsum; anhydrite; plasters (consisting of calcined gypsum or calcium sulfate) whether or not colored, with or without small quantities of accelerators or retarders:","Gypsum; anhydrite; plasters (consisting of calcined gypsum or calcium sulfate) whether or not colored, with or without small quantities of accelerators or retarders:",,,,1,1,GYPSUM
25,2523,252320,Dry Bulk,Construction Materials,Cement,Portland Cement,PORTLAND,10,65000,KEEP,"Portland cement, aluminous cement, slag cement, supersulfate cement and similar hydraulic cements, whether or not colored or in the form of clinkers:","Portland cement, aluminous cement, slag cement, supersulfate cement and similar hydraulic cements, whether or not colored or in the form of clinkers:",Classified: 2523.21,"Abu Kir Bay, Egypt",Amreyah Cement Co.,1,1,PORTLAND
25,2525,252525,Dry Bulk,Minerals & Ores,Minerals,Mica,MICA,,,KEEP,"Mica, including splittings; mica waste:","Mica, including splittings; mica waste:",,,,1,1,MICA
25,2526,252606,Dry Bulk,Minerals & Ores,Talc,Talc,TALC,,,KEEP,"Natural steatite, whether or not roughly trimmed or merely cut, by sawing or otherwise, into blocks or slabs of a rectangular (including square) shape; talc:","Natural steatite, whether or not roughly trimmed or merely cut, by sawing or otherwise, into blocks or slabs of a rectangular (including square) shape; talc:",Classified: 2526.20,"Karachi, Pakistan",,1,1,TALC
25,2528,252850,Dry Bulk,Minerals & Ores,Minerals,"Ulexite,Boron ?","BORON ?, ULEXITE",,,KEEP,"Natural borates and concentrates thereof (whether or not calcined), but not including borates separated from natural brine",natural boric acid containing not more than 85 % of H3BO3 calculated on the dry weight,,,,1,1,BORON ?; ULEXITE
25,2529,252922,Dry Bulk,Minerals & Ores,Minerals,"Fluorspar, Feldspar","FELDSPAR, FLUORSPAR",,,KEEP,"Feldspar; leucite, nepheline and nepheline syenite; fluorspar:","Feldspar; leucite, nepheline and nepheline syenite; fluorspar:",,,,1,1,FELDSPAR; FLUORSPAR
25,2530,253000,Dry Bulk,Minerals & Ores,Minerals,Vermiculite,"PERLITE, VERMICULITE",,,KEEP,Mineral substances not elsewhere specified or included:,Mineral substances not elsewhere specified or included:,,,,1,1,PERLITE; VERMICULITE
26,2601,260111,Dry Bulk,Ferrous Raw Materials,Iron Products,Iron Ore,TUBARAO,,,KEEP,"Iron ores and concentrates, including roasted iron pyrites:","Iron ores and concentrates, including roasted iron pyrites:",Classified: 2601.12,"Praia Mole, Brazil",Vale S.A.,1,1,TUBARAO
26,2602,260260,Dry Bulk,Ferrous Raw Materials,Manganese,Managese,MANGANESE,,,KEEP,"Manganese ores and concentrates, including ferruginous manganese ores and concentrates with a manganese content of 20% or more, calculated on the dry weight","Manganese ores and concentrates, including ferruginous manganese ores and concentrates with a manganese content of 20% or more, calculated on the dry weight",,,,1,1,MANGANESE
26,2603,260305,Dry Bulk,Ferrous Raw Materials,TBN,TBN,"CONCENTRATE, COPPER CONCENTRATES",,,KEEP,Copper ores and concentrates,Copper ores and concentrates,,,,1,1,CONCENTRATE; COPPER CONCENTRATES
26,2606,260659,Dry Bulk,Non-Ferrous Raw Materials,Bauxite,Bauxite,BAUXITE,,,KEEP,Aluminium ores and concentrates,Aluminium ores and concentrates,Classified: 2606.00,"Aliaga, Turkey",Ep Power Minerals Gmb H,1,1,BAUXITE
26,2607,260720,Dry Bulk,Ferrous Raw Materials,TBN,TBN,LEAD CONCENTRATES,,,KEEP,Lead ores and concentrates,Lead ores and concentrates,,,,1,1,LEAD CONCENTRATES
26,2608,260800,Dry Bulk,Ferrous Raw Materials,TBN,TBN,ZINC CONCENTRATES,,,KEEP,Zinc ores and concentrates,Zinc ores and concentrates,,,,1,1,ZINC CONCENTRATES
26,2610,261000,Dry Bulk,Ferrous Raw Materials,chromite,chromite,CHROMITE ORE,,,KEEP,Chromium ores and concentrates,Chromium ores and concentrates,,,,1,1,CHROMITE ORE
26,2614,261400,Dry Bulk,Ferrous Raw Materials,Minerals,TiSlag,"ILMENITE, TIOS, TISLAG, TITANIUM BEARING SLAG, TITANIUM CHLORIDE",,,KEEP,Titanium ores and concentrates,Titanium ores and concentrates,Classified: 2614.00,"Richard's Bay, South Africa",Richards Bay Titanium (Pty) ) Ltd.,1,1,ILMENITE; TIOS; TISLAG; TITANIUM BEARING SLAG; TITANIUM CHLORIDE
26,2615,261510,Dry Bulk,Ferrous Raw Materials,TBN,TBN,ZIRCON ?,,,KEEP,"Niobium (columbium), tantalum, vanadium or zirconium ores and concentrates:","Niobium (columbium), tantalum, vanadium or zirconium ores and concentrates:",,,,1,1,ZIRCON ?
26,2617,261706,Dry Bulk,Ferrous Raw Materials,TBN,TBN,SPODUMENE CONCENTRATE,,,KEEP,Other ores and concentrates:,Other ores and concentrates:,,,,1,1,SPODUMENE CONCENTRATE
26,2618,261800,Dry Bulk,Ferrous Raw Materials,SCM's,Slags TBN,GRANULATED BLAST,,,KEEP,Granulated slag (slag sand) from the manufacture of iron or steel,Granulated slag (slag sand) from the manufacture of iron or steel,,,,1,1,GRANULATED BLAST
26,2619,261903,Dry Bulk,Ferrous Raw Materials,Minerals,TiSlag,"ILMENITE, TIOS, TISLAG, TITANIUM BEARING SLAG, TITANIUM CHLORIDE",,,KEEP,"Slag, dross","(other than granulated slag), scalings and other waste from the manufacture of iron or steel",Classified: 2619.00,"Richard's Bay, South Africa",Richards Bay Titanium (Pty) ) Ltd.,1,1,ILMENITE; TIOS; TISLAG; TITANIUM BEARING SLAG; TITANIUM CHLORIDE
26,2620,262024,Dry Bulk,Ferrous Raw Materials,Slags & Assh,Slags TBN,"BEARING, SLAG, TITANIUM, UGS",,,KEEP,"Slag, ash and residues (other than from the manufacture of iron or steel), containing arsenic, metals or their compounds:","Slag, ash and residues (other than from the manufacture of iron or steel), containing arsenic, metals or their compounds:",Classified: 2620.99,"Sorel, Que, Canada",Rio Tinto Fer Et Titane Inc.,1,1,BEARING; SLAG; TITANIUM; UGS
26,2621,262152,Dry Bulk,Construction Materials,SCM's,Fly Ash,ASH,,,KEEP,"Other slag and ash, including seaweed ash (kelp); ash and residues from the incineration of municipal waste:","Other slag and ash, including seaweed ash (kelp); ash and residues from the incineration of municipal waste:",,,,1,1,ASH
27,2701,270187,Dry Bulk,Solid Fuels,Coal,Coal,"ANTHRACITE, COAL",,,KEEP,"Coal; briquettes, ovoids and similar solid fuels manufactured from coal:","Coal; briquettes, ovoids and similar solid fuels manufactured from coal:",,,,1,1,ANTHRACITE; COAL
27,2704,270400,Dry Bulk,Solid Fuels,coal coke,Coke,"COKE, SASCOKE",,,KEEP,Coke and semi-coke,"of coal, lignite or peat, whether or not agglomerated; retort carbon",,,,1,1,COKE; SASCOKE
27,2706,270610,Break-Bulk,General Cargo,General Cargo,General Cargo,GENERAL CARGO,0,10000,KEEP,"Tar distilled from coal, from lignite, peat and other mineral tars, whether or not dehydrated or partially distilled",including reconstituted tars,,,,1,1,GENERAL CARGO
27,2711,002711,Break-Bulk,General Cargo,General Cargo,General Cargo,GENERAL CARGO,0,10000,KEEP,Petroleum gases and other gaseous hydrocarbons:,Petroleum gases and other gaseous hydrocarbons:,,,,1,1,GENERAL CARGO
27,2713,271312,Dry Bulk,Solid Fuels,Petcoke,Petcoke,"COKE, PETROLEUM, RAW",,,KEEP,"Petroleum coke, petroleum bitumen and other residues of petroleum oils or of oils obtained from bituminous minerals:","Petroleum coke, petroleum bitumen and other residues of petroleum oils or of oils obtained from bituminous minerals:",Classified: 2713.12,"Cartagena, Colombia",,1,1,COKE; PETROLEUM; RAW
27,2714,027142,Break-Bulk,General Cargo,General Cargo,General Cargo,GENERAL CARGO,0,10000,KEEP,"Bitumen and asphalt, natural; bituminous or oil shale and tar sands; asphaltites and asphaltic rocks:","Bitumen and asphalt, natural; bituminous or oil shale and tar sands; asphaltites and asphaltic rocks:",,,,1,1,GENERAL CARGO
28,2804,280405,Break-Bulk,General Cargo,General Cargo,General Cargo,GENERAL CARGO,0,10000,KEEP,"Hydrogen, rare gases and other nonmetals:","Hydrogen, rare gases and other nonmetals:",,,,1,1,GENERAL CARGO
28,2810,028100,Dry Bulk,Non-Ferrous Raw Materials,Minerals,Etibor,"BORIC ACID, BORON OXIDE",,,KEEP,Oxides of boron,boric acids,,,,1,1,BORIC ACID; BORON OXIDE
28,2811,281120,Break-Bulk,General Cargo,General Cargo,General Cargo,GENERAL CARGO,0,10000,KEEP,Other inorganic acids and other inorganic oxygen compounds of nonmetals:,Other inorganic acids and other inorganic oxygen compounds of nonmetals:,,,,1,1,GENERAL CARGO
28,2812,281200,Break-Bulk,General Cargo,General Cargo,General Cargo,GENERAL CARGO,0,10000,KEEP,Halides and halide oxides of nonmetals:,Halides and halide oxides of nonmetals:,,,,1,1,GENERAL CARGO
28,2815,281501,Break-Bulk,General Cargo,General Cargo,General Cargo,GENERAL CARGO,0,10000,KEEP,Sodium hydroxide (Caustic soda); potassium hydroxide (Caustic potash); peroxides of sodium or potassium:,Sodium hydroxide (Caustic soda); potassium hydroxide (Caustic potash); peroxides of sodium or potassium:,,,,1,1,GENERAL CARGO
28,2818,281823,Dry Bulk,Non-Ferrous Raw Materials,Alumina,Alumina,"ALUMINA, ALUMINUM HYDROXIDE",,,KEEP,"Artificial corundum, whether or not chemically defined; aluminum oxide; aluminum hydroxide:","Artificial corundum, whether or not chemically defined; aluminum oxide; aluminum hydroxide:",,,,1,1,ALUMINA; ALUMINUM HYDROXIDE
28,2820,002820,Dry Bulk,Misc Bulk,tbn bulkk,TBN,MANGANESE,,,KEEP,Manganese oxides:,Manganese oxides:,,,,1,1,MANGANESE
28,2825,282543,Dry Bulk,Misc Bulk,tbn bulkk,tbn,ALUMINIUM FLUORIDE ALUMINIUM FLUORIDE,,,KEEP,"Hydrazine and hydroxylamine and their inorganic salts; other inorganic bases; other metal oxides, hydroxides and peroxides:","Hydrazine and hydroxylamine and their inorganic salts; other inorganic bases; other metal oxides, hydroxides and peroxides:",,,,1,1,ALUMINIUM FLUORIDE ALUMINIUM FLUORIDE
28,2826,282628,Dry Bulk,Misc Bulk,tbn bulkk,TBN,ALUMINIUM FLUORIDE ALUMINIUM FLUORIDE,,,KEEP,"Fluorides; fluorosilicates, fluoroaluminates and other complex fluorine salts:","Fluorides; fluorosilicates, fluoroaluminates and other complex fluorine salts:",,,,1,1,ALUMINIUM FLUORIDE ALUMINIUM FLUORIDE
28,2827,282709,Dry Bulk,Non-Ferrous Raw Materials,TBN,Chlorides,"CALCIUM CHLORIDE, MAGNESIUM CHLORIDE",,,KEEP,"Chlorides, chloride oxides and chloride hydroxides; bromides and bromide oxides; iodides and iodide oxides:","Chlorides, chloride oxides and chloride hydroxides; bromides and bromide oxides; iodides and iodide oxides:",,,,1,1,CALCIUM CHLORIDE; MAGNESIUM CHLORIDE
28,2832,283275,Dry Bulk,Misc Bulk,tbn bulkk,Sulfites,"SODIUM METABISULFITE, SODIUM METABISULPHITE",,,KEEP,Sulfites; thiosulfates:,Sulfites; thiosulfates:,,,,1,1,SODIUM METABISULFITE; SODIUM METABISULPHITE
28,2833,002833,Dry Bulk,Fertilizer,Fertilizer,Sulphates,"FERROUS SULPHATE, KEMIRA, MAGNESIUM SULPHATE, SODIUM SULPHATE, ZINC SULFATE",,,KEEP,Sulfates; alums; peroxosulfates (persulfates):,Sulfates; alums; peroxosulfates (persulfates):,,,,1,1,FERROUS SULPHATE; KEMIRA; MAGNESIUM SULPHATE; SODIUM SULPHATE; ZINC SULFATE
28,2834,028344,Dry Bulk,Fertilizer,Fertilizer,Nitrates,"CALCINIT, NITRATE",,,KEEP,Nitrites; nitrates:,Nitrites; nitrates:,,,,1,1,CALCINIT; NITRATE
28,2840,284010,Dry Bulk,Non-Ferrous Raw Materials,Minerals,Etibor,"BORAX, ETIBOR",,,KEEP,Borates; peroxoborates (perborates):,Borates; peroxoborates (perborates):,,,,1,1,BORAX; ETIBOR
28,2849,284977,Dry Bulk,Non-Ferrous Raw Materials,tbn,Silicon Carbide,SILICON CARBIDE,,,KEEP,"Carbides, whether or not chemically defined:","Carbides, whether or not chemically defined:",,,,1,1,SILICON CARBIDE
29,2903,290308,Break-Bulk,General Cargo,General Cargo,General Cargo,GENERAL CARGO,0,10000,KEEP,Halogenated derivatives of hydrocarbons:,Halogenated derivatives of hydrocarbons:,,,,1,1,GENERAL CARGO
29,2915,291501,Break-Bulk,General Cargo,General Cargo,General Cargo,GENERAL CARGO,0,10000,KEEP,"Saturated acyclic monocarboxylic acids and their anhydrides, halides, peroxides and peroxyacids; their halogenated, sulfonated, nitrated or nitrosated derivatives:","Saturated acyclic monocarboxylic acids and their anhydrides, halides, peroxides and peroxyacids; their halogenated, sulfonated, nitrated or nitrosated derivatives:",,,,1,1,GENERAL CARGO
29,2918,291861,Break-Bulk,General Cargo,General Cargo,General Cargo,GENERAL CARGO,0,10000,KEEP,"Carboxylic acids with additional oxygen function and their anhydrides, halides, peroxides and peroxyacids; their halogenated, sulfonated, nitrated or nitrosated derivatives:","Carboxylic acids with additional oxygen function and their anhydrides, halides, peroxides and peroxyacids; their halogenated, sulfonated, nitrated or nitrosated derivatives:",,,,1,1,GENERAL CARGO
29,2922,292216,Break-Bulk,General Cargo,General Cargo,General Cargo,GENERAL CARGO,0,10000,KEEP,Oxygen-function amino-compounds:,Oxygen-function amino-compounds:,,,,1,1,GENERAL CARGO
29,2931,293131,Break-Bulk,General Cargo,General Cargo,General Cargo,GENERAL CARGO,0,10000,KEEP,Other organo-inorganic compounds:,Other organo-inorganic compounds:,,,,1,1,GENERAL CARGO
30,3002,300200,Break-Bulk,General Cargo,General Cargo,General Cargo,GENERAL CARGO,0,10000,KEEP,"Human blood; animal blood prepared for therapeutic, prophylactic or diagnostic uses; antisera, other blood fractions and immunological products, whether or not modified or obtained by means of biotechnological processes; vaccines, toxins, cultures of micro-organisms (excluding yeasts) and similar products; cell cultures, whether or not modified:","Human blood; animal blood prepared for therapeutic, prophylactic or diagnostic uses; antisera, other blood fractions and immunological products, whether or not modified or obtained by means of biotechnological processes; vaccines, toxins, cultures of micro-organisms (excluding yeasts) and similar products; cell cultures, whether or not modified:",,,,1,1,GENERAL CARGO
30,3004,300430,Break-Bulk,General Cargo,General Cargo,General Cargo,GENERAL CARGO,0,10000,KEEP,"Medicaments (excluding goods of heading 3002, 3005 or 3006) consisting of mixed or unmixed products for therapeutic or prophylactic uses, put up in measured doses (including those in the form of transdermal administration systems) or in forms or packings for retail sale:","Medicaments (excluding goods of heading 3002, 3005 or 3006) consisting of mixed or unmixed products for therapeutic or prophylactic uses, put up in measured doses (including those in the form of transdermal administration systems) or in forms or packings for retail sale:",,,,1,1,GENERAL CARGO
30,3006,300684,Break-Bulk,General Cargo,General Cargo,General Cargo,GENERAL CARGO,0,10000,KEEP,Pharmaceutical goods specified in note 4 to this chapter:,Pharmaceutical goods specified in note 4 to this chapter:,,,,1,1,GENERAL CARGO
31,3102,310210,Dry Bulk,Fertilizer,Nitrogen Fertilizers,Urea,UREA,10,50000,KEEP,"Mineral or chemical fertilizers, nitrogenous:","Mineral or chemical fertilizers, nitrogenous:",,,,1,1,UREA
31,3103,310310,Dry Bulk,Fertilizer,Fertilizer,Potassium Fertilizers,"KALISOP, NPK, POTASH, POTASSIUM CHLORIDE, POTASSIUM SULPHATE",,,KEEP,"Mineral or chemical fertilizers, phosphatic:","Mineral or chemical fertilizers, phosphatic:",,,,1,1,KALISOP; NPK; POTASH; POTASSIUM CHLORIDE; POTASSIUM SULPHATE
31,3104,310430,Dry Bulk,Fertilizer,Nitrogen Fertilizers,Urea,"GRADE, GRANULAR, MURIATE, SUPERBLEND, TASH",,,KEEP,"Mineral or chemical fertilizers, potassic:","Mineral or chemical fertilizers, potassic:",Classified: 3104.30,"Fort Williams, Ont, Canada",Canpotex Ltd.,1,1,GRADE; GRANULAR; MURIATE; SUPERBLEND; TASH
31,3105,310540,Dry Bulk,Fertilizer,Phospuours,MAP/DAP,"BULK, NITROGEN, NPS, PHOSPHORUS, SULPHUR",,,KEEP,"Mineral or chemical fertilizers containing two or three of the fertilizing elements nitrogen, phosphorus and potassium; other fertilizers; goods of this chapter in tablets or similar forms or in packages of a gross weight not exceeding 10 kg:","Mineral or chemical fertilizers containing two or three of the fertilizing elements nitrogen, phosphorus and potassium; other fertilizers; goods of this chapter in tablets or similar forms or in packages of a gross weight not exceeding 10 kg:",Classified: 3105.20,"Klaipeda, Lithuania",Ab Lifosa,1,1,BULK; NITROGEN; NPS; PHOSPHORUS; SULPHUR
