75,7507,750750,Break-Bulk,Metals,Nickel,Nickle,NICKEL,1.5,60000,KEEP,"Nickel tubes, pipes and tube or pipe fittings (for example, couplings, elbows, sleeves):","Nickel tubes, pipes and tube or pipe fittings (for example, couplings, elbows, sleeves):",,,,1,1,NICKEL
76,7601,760100,Break-Bulk,Metals,Aluminum,Unwrouge Aluminium,"CSI, GRADE, ROLLING, SLABS, UNTRIMMED",1.5,60000,KEEP,Unwrought aluminum:,Unwrought aluminum:,Classified: 7601.20,"Port Kembla, Australia",,1,1,CSI; GRADE; ROLLING; SLABS; UNTRIMMED
76,7602,760200,Break-Bulk,Metals,Aluminum,Scrap Aluminum,"COMPRESSED ALUMINUM CANS, SCRAP",1.5,60000,KEEP,Aluminium waste and scrap,Aluminium waste and scrap,,,,1,1,COMPRESSED ALUMINUM CANS; SCRAP
76,7603,760300,Break-Bulk,Metals,Aluminum,Scrap Aluminum,"COMPRESSED ALUMINUM CANS, SCRAP",1.5,60000,KEEP,Aluminum powders and flakes:,Aluminum powders and flakes:,,,,1,1,COMPRESSED ALUMINUM CANS; SCRAP
76,7604,760440,Break-Bulk,Metals,Aluminum,Aluminum,"ALUMINIUM BILLET. ALUMINIUM FOUNDRY, ALUMINUM INGOTS, PRIMARY ALUMINIUM, SOWS, T BARS",1.5,60000,KEEP,"Aluminum bars, rods and profiles:","Aluminum bars, rods and profiles:",,,,1,1,ALUMINIUM BILLET. ALUMINIUM FOUNDRY; ALUMINUM INGOTS; PRIMARY ALUMINIUM; SOWS; T BARS
76,7605,076050,Break-Bulk,Metals,Aluminum,Aluminum,OTHER\,1.5,60000,KEEP,Aluminum wire:,Aluminum wire:,,,,1,1,OTHER\
76,7606,760632,Break-Bulk,Metals,Aluminum,Flat Rolled Products,"PLATE, SHEET, STRIP - ALUMINUM",1.5,60000,KEEP,"Aluminum plates, sheets and strip, of a thickness exceeding 0.2 mm:","Aluminum plates, sheets and strip, of a thickness exceeding 0.2 mm:",,,,1,1,PLATE; SHEET; STRIP - ALUMINUM
76,7607,760760,Break-Bulk,Metals,Aluminum,Aluminum,ALUMINUM OTHER,1.5,60000,KEEP,"Aluminum foil (whether or not printed, or backed with paper, paperboard, plastics or similar backing materials) of a thickness (excluding any backing) not exceeding 0.2 mm:","Aluminum foil (whether or not printed, or backed with paper, paperboard, plastics or similar backing materials) of a thickness (excluding any backing) not exceeding 0.2 mm:",,,,1,1,ALUMINUM OTHER
76,7609,760995,Break-Bulk,Metals,Aluminum,Aluminum,ALUMINUM OTHER,1.5,60000,KEEP,"Aluminium tube or pipe fittings (for example, couplings, elbows, sleeves)","Aluminium tube or pipe fittings (for example, couplings, elbows, sleeves)",,,,1,1,ALUMINUM OTHER
76,7610,761010,Break-Bulk,Metals,Aluminum,Aluminum,ALUMINUM OTHER,1.5,60000,KEEP,"Aluminum structures (excluding prefabricated buildings of heading 9406) and parts of structures (for example, bridges and bridge-sections, towers, lattice masts, roofs, roofing frameworks, doors and windows and their frames and thresholds for doors, balustrades, pillars and columns); aluminum plates, rods, profiles, tubes and the like, prepared for use in structures:","Aluminum structures (excluding prefabricated buildings of heading 9406) and parts of structures (for example, bridges and bridge-sections, towers, lattice masts, roofs, roofing frameworks, doors and windows and their frames and thresholds for doors, balustrades, pillars and columns); aluminum plates, rods, profiles, tubes and the like, prepared for use in structures:",,,,1,1,ALUMINUM OTHER
76,7612,076123,Break-Bulk,Metals,Aluminum,Aluminum,ALUMINUM OTHER,1.5,60000,KEEP,"Aluminum casks, drums, cans, boxes and similar containers (including rigid or collapsible tubular containers), for any material (other than compressed or liquefied gas), of a capacity not exceeding 300 liters, whether or not lined or heat insulated, but not fitted with mechanical or thermal equipment:","Aluminum casks, drums, cans, boxes and similar containers (including rigid or collapsible tubular containers), for any material (other than compressed or liquefied gas), of a capacity not exceeding 300 liters, whether or not lined or heat insulated, but not fitted with mechanical or thermal equipment:",,,,1,1,ALUMINUM OTHER
76,7613,761332,Break-Bulk,Metals,Aluminum,Aluminum,ALUMINUM OTHER,1.5,60000,KEEP,Aluminium containers for compressed or liquefied gas,Aluminium containers for compressed or liquefied gas,,,,1,1,ALUMINUM OTHER
76,7614,761459,Break-Bulk,Metals,Aluminum,Aluminum,ALUMINUM OTHER,1.5,60000,KEEP,"Stranded wire, cables, plaited bands and the like, including slings and similar articles, of aluminum, not electrically insulated:","Stranded wire, cables, plaited bands and the like, including slings and similar articles, of aluminum, not electrically insulated:",,,,1,1,ALUMINUM OTHER
76,7616,761699,Break-Bulk,Metals,Aluminum,Aluminum,ALUMINUM OTHER,1.5,60000,KEEP,Other articles of aluminum:,Other articles of aluminum:,,,,1,1,ALUMINUM OTHER
78,7801,780140,Break-Bulk,Metals,Lead,Ingot,"LEAD INGOT, PRIMARY LEAD, REFINED LEAD",1.5,60000,KEEP,Unwrought lead:,Unwrought lead:,,,,1,1,LEAD INGOT; PRIMARY LEAD; REFINED LEAD
79,7901,790111,Break-Bulk,Metals,Zinc,Ingot,"ZINC, ZINC INGOT",1.5,60000,KEEP,Unwrought zinc:,Unwrought zinc:,,,,1,1,ZINC; ZINC INGOT
81,8104,810401,Dry Bulk,Misc Bulk,tbn bulkk,tbn,MAGNESIUM,,,KEEP,"Magnesium and articles thereof, including waste and scrap:","Magnesium and articles thereof, including waste and scrap:",,,,1,1,MAGNESIUM
81,8105,810550,Dry Bulk,Misc Bulk,tbn bulkk,tbn,TBN,,,KEEP,"Cobalt mattes and other intermediate products of cobalt metallurgy; cobalt and articles thereof, including waste and scrap:","Cobalt mattes and other intermediate products of cobalt metallurgy; cobalt and articles thereof, including waste and scrap:",,,,1,1,TBN
81,8111,811100,Dry Bulk,Misc Bulk,tbn bulkk,tbn,MANGANESE,,,KEEP,"Manganese and articles thereof, including waste and scrap","Manganese and articles thereof, including waste and scrap",,,,1,1,MANGANESE
82,8202,820240,Break-Bulk,General Cargo,Machinery,Machinery,MACHINERY,0,10000,KEEP,"Handsaws, and metal parts thereof; blades for saws of all kinds (including slitting, slotting or toothless saw blades), and base metal parts thereof:","Handsaws, and metal parts thereof; blades for saws of all kinds (including slitting, slotting or toothless saw blades), and base metal parts thereof:",,,,1,1,MACHINERY
82,8203,820343,Break-Bulk,General Cargo,Machinery,Machinery,MACHINERY,0,10000,KEEP,"Files, rasps, pliers (including cutting pliers), pincers, tweezers, metal cutting shears, pipe cutters, bolt cutters, perforating punches and similar handtools, and base metal parts thereof:","Files, rasps, pliers (including cutting pliers), pincers, tweezers, metal cutting shears, pipe cutters, bolt cutters, perforating punches and similar handtools, and base metal parts thereof:",,,,1,1,MACHINERY
82,8204,820411,Break-Bulk,General Cargo,Machinery,Machinery,MACHINERY,0,10000,KEEP,"Hand-operated spanners and wrenches (including torque meter wrenches but not including tap wrenches); socket wrenches, with or without handles, drives or extensions; base metal parts thereof:","Hand-operated spanners and wrenches (including torque meter wrenches but not including tap wrenches); socket wrenches, with or without handles, drives or extensions; base metal parts thereof:",,,,1,1,MACHINERY
82,8205,082055,Break-Bulk,General Cargo,Machinery,Machinery,MACHINERY,0,10000,KEEP,"Handtools (including glass cutters) not elsewhere specified or included; blow torches and similar self-contained torches; vises, clamps and the like, other than accessories for and parts of machine tools or water-jet cutting machines; anvils; portable forges; hand- or pedal-operated grinding wheels with frameworks; base metal parts thereof:","Handtools (including glass cutters) not elsewhere specified or included; blow torches and similar self-contained torches; vises, clamps and the like, other than accessories for and parts of machine tools or water-jet cutting machines; anvils; portable forges; hand- or pedal-operated grinding wheels with frameworks; base metal parts thereof:",,,,1,1,MACHINERY
82,8207,820719,Break-Bulk,General Cargo,Machinery,Machinery,MACHINERY,0,10000,KEEP,"Interchangeable tools for handtools, whether or not power operated, or for machine-tools (for example, for pressing, stamping, punching, tapping, threading, drilling, boring, broaching, milling, turning or screwdriving), including dies for drawing or extruding metal, and rock drilling or earth boring tools; base metal parts thereof:","Interchangeable tools for handtools, whether or not power operated, or for machine-tools (for example, for pressing, stamping, punching, tapping, threading, drilling, boring, broaching, milling, turning or screwdriving), including dies for drawing or extruding metal, and rock drilling or earth boring tools; base metal parts thereof:",,,,1,1,MACHINERY
82,8208,820820,Break-Bulk,General Cargo,Machinery,Machinery,MACHINERY,0,10000,KEEP,"Knives and cutting blades, for machines or for mechanical appliances, and base metal parts thereof:","Knives and cutting blades, for machines or for mechanical appliances, and base metal parts thereof:",,,,1,1,MACHINERY
82,8210,821031,Break-Bulk,General Cargo,Machinery,Machinery,MACHINERY,0,10000,KEEP,"Hand-operated mechanical appliances, weighing 10 kg or less, used in the preparation, conditioning or serving of food or drink",and base metal parts thereof,,,,1,1,MACHINERY
82,8211,008211,Break-Bulk,General Cargo,Machinery,Machinery,MACHINERY,0,10000,KEEP,"Knives with cutting blades, serrated or not (including pruning knives), other than knives of heading 8208, and blades and other base metal parts thereof:","Knives with cutting blades, serrated or not (including pruning knives), other than knives of heading 8208, and blades and other base metal parts thereof:",,,,1,1,MACHINERY
83,8301,830150,Break-Bulk,General Cargo,Machinery,Machinery,MACHINERY,0,10000,KEEP,"Padlocks and locks (key, combination or electrically operated), of base metal; clasps and frames with clasps, incorporating locks, of base metal; keys and parts of any of the foregoing articles, of base metal:","Padlocks and locks (key, combination or electrically operated), of base metal; clasps and frames with clasps, incorporating locks, of base metal; keys and parts of any of the foregoing articles, of base metal:",,,,1,1,MACHINERY
83,8302,830241,Break-Bulk,General Cargo,Machinery,Machinery,MACHINERY,0,10000,KEEP,"Base metal mountings, fittings and similar articles suitable for furniture, doors, staircases, windows, blinds, coachwork, saddlery, trunks, chests, caskets or the like; base metal hat racks, hat-pegs, brackets and similar fixtures; castors with mountings of base metal; automatic door closers of base metal; and base metal parts thereof:","Base metal mountings, fittings and similar articles suitable for furniture, doors, staircases, windows, blinds, coachwork, saddlery, trunks, chests, caskets or the like; base metal hat racks, hat-pegs, brackets and similar fixtures; castors with mountings of base metal; automatic door closers of base metal; and base metal parts thereof:",,,,1,1,MACHINERY
83,8305,830538,Break-Bulk,General Cargo,Machinery,Machinery,MACHINERY,0,10000,KEEP,"Fittings for looseleaf binders or files, letter clips, letter corners, paper clips, indexing tags and similar office articles, and parts thereof, of base metal; staples in strips (for example, for offices, upholstery, packaging), of base metal:","Fittings for looseleaf binders or files, letter clips, letter corners, paper clips, indexing tags and similar office articles, and parts thereof, of base metal; staples in strips (for example, for offices, upholstery, packaging), of base metal:",,,,1,1,MACHINERY
83,8307,830710,Break-Bulk,General Cargo,Machinery,Machinery,MACHINERY,0,10000,KEEP,"Flexible tubing of base metal, with or without fittings:","Flexible tubing of base metal, with or without fittings:",,,,1,1,MACHINERY
83,8308,830842,Break-Bulk,General Cargo,Machinery,Machinery,MACHINERY,0,10000,KEEP,"Clasps, frames with clasps, buckles, buckle-clasps, hooks, eyes, eyelets and the like, of base metal, of a kind used for clothing or clothing accessories, footwear, jewelry, wrist watches, books, awnings, leather goods, travel goods or saddlery or for other made up articles; tubular or bifurcated rivets, of base metal; beads and spangles, of base metal:","Clasps, frames with clasps, buckles, buckle-clasps, hooks, eyes, eyelets and the like, of base metal, of a kind used for clothing or clothing accessories, footwear, jewelry, wrist watches, books, awnings, leather goods, travel goods or saddlery or for other made up articles; tubular or bifurcated rivets, of base metal; beads and spangles, of base metal:",,,,1,1,MACHINERY
83,8309,830904,Break-Bulk,General Cargo,Machinery,Machinery,MACHINERY,0,10000,KEEP,"Stoppers, caps and lids (including crown corks, screw caps and pouring stoppers), capsules for bottles, threaded bungs, bung covers, seals and other packing accessories, and parts thereof, of base metal:","Stoppers, caps and lids (including crown corks, screw caps and pouring stoppers), capsules for bottles, threaded bungs, bung covers, seals and other packing accessories, and parts thereof, of base metal:",,,,1,1,MACHINERY
83,8310,831000,Break-Bulk,General Cargo,Machinery,Machinery,MACHINERY,0,10000,KEEP,"Sign-plates, name-plates, address-plates and similar plates, numbers, letters and other symbols, of base metal, excluding those of heading 94.05","Sign-plates, name-plates, address-plates and similar plates, numbers, letters and other symbols, of base metal, excluding those of heading 94.05",,,,1,1,MACHINERY
83,8311,831150,Break-Bulk,General Cargo,Machinery,Machinery,MACHINERY,0,10000,KEEP,"Wire, rods, tubes, plates, electrodes and similar products of base metal or of metal carbides, coated or cored with flux material, of a kind used for soldering, brazing, welding or deposition of metal or of metal carbides; wire and rods, of agglomerated base metal powder, used for metal spraying; base metal parts thereof:","Wire, rods, tubes, plates, electrodes and similar products of base metal or of metal carbides, coated or cored with flux material, of a kind used for soldering, brazing, welding or deposition of metal or of metal carbides; wire and rods, of agglomerated base metal powder, used for metal spraying; base metal parts thereof:",,,,1,1,MACHINERY
84,8401,840110,Break-Bulk,General Cargo,Vehicles & Machinery,Vehicles & Machine,MACHINERY,0,10000,KEEP,"Nuclear reactors; fuel elements (cartridges), non-irradiated, for nuclear reactors; machinery and apparatus for isotopic separation; parts thereof:","Nuclear reactors; fuel elements (cartridges), non-irradiated, for nuclear reactors; machinery and apparatus for isotopic separation; parts thereof:",,,,1,1,MACHINERY
84,8402,840200,Break-Bulk,General Cargo,Vehicles & Machinery,Vehicles & Machine,MACHINERY,0,10000,KEEP,Steam or other vapor generating boilers (other than central heating hot water boilers capable also of producing low pressure steam); super-heated water boilers; parts thereof:,Steam or other vapor generating boilers (other than central heating hot water boilers capable also of producing low pressure steam); super-heated water boilers; parts thereof:,,,,1,1,MACHINERY
84,8404,840490,Break-Bulk,General Cargo,Vehicles & Machinery,Vehicles & Machine,MACHINERY,0,10000,KEEP,"Auxiliary plant for use with boilers of heading 8402 or 8403 (for example, economizers, super-heaters, soot removers, gas recoverers); condensers for steam or other vapor power units; parts thereof:","Auxiliary plant for use with boilers of heading 8402 or 8403 (for example, economizers, super-heaters, soot removers, gas recoverers); condensers for steam or other vapor power units; parts thereof:",,,,1,1,MACHINERY
84,8405,840524,Break-Bulk,General Cargo,Vehicles & Machinery,Vehicles & Machine,MACHINERY,0,10000,KEEP,"Producer gas or water gas generators, with or without their purifiers; acetylene gas generators and similar water process gas generators, with or without their purifiers; parts thereof:","Producer gas or water gas generators, with or without their purifiers; acetylene gas generators and similar water process gas generators, with or without their purifiers; parts thereof:",,,,1,1,MACHINERY
84,8406,840690,Break-Bulk,General Cargo,Vehicles & Machinery,Vehicles & Machine,MACHINERY,0,10000,KEEP,"Steam turbines and other vapor turbines, and parts thereof:","Steam turbines and other vapor turbines, and parts thereof:",,,,1,1,MACHINERY
84,8407,840718,Break-Bulk,General Cargo,Vehicles & Machinery,Vehicles & Machine,MACHINERY,0,10000,KEEP,Spark-ignition reciprocating or rotary internal combustion piston engines:,Spark-ignition reciprocating or rotary internal combustion piston engines:,,,,1,1,MACHINERY
84,8408,840820,Break-Bulk,General Cargo,Vehicles & Machinery,Vehicles & Machine,MACHINERY,0,10000,KEEP,Compression-ignition internal combustion piston engines (diesel or semi-diesel engines):,Compression-ignition internal combustion piston engines (diesel or semi-diesel engines):,,,,1,1,MACHINERY
84,8409,840999,Break-Bulk,General Cargo,Vehicles & Machinery,Vehicles & Machine,MACHINERY,0,10000,KEEP,Parts suitable for use solely or principally with the engines of heading 8407 or 8408:,Parts suitable for use solely or principally with the engines of heading 8407 or 8408:,,,,1,1,MACHINERY
84,8410,841000,Break-Bulk,General Cargo,Vehicles & Machinery,Vehicles & Machine,MACHINERY,0,10000,KEEP,"Hydraulic turbines, water wheels and regulators therefor; parts thereof:","Hydraulic turbines, water wheels and regulators therefor; parts thereof:",,,,1,1,MACHINERY
84,8411,841199,Break-Bulk,General Cargo,Vehicles & Machinery,Vehicles & Machine,MACHINERY,0,10000,KEEP,"Turbojets, turbopropellers and other gas turbines, and parts thereof:","Turbojets, turbopropellers and other gas turbines, and parts thereof:",,,,1,1,MACHINERY
84,8412,841221,Break-Bulk,General Cargo,Vehicles & Machinery,Vehicles & Machine,MACHINERY,0,10000,KEEP,"Other engines and motors, and parts thereof:","Other engines and motors, and parts thereof:",,,,1,1,MACHINERY
84,8413,841340,Break-Bulk,General Cargo,Vehicles & Machinery,Vehicles & Machine,MACHINERY,0,10000,KEEP,"Pumps for liquids, whether or not fitted with a measuring device; liquid elevators; part thereof:","Pumps for liquids, whether or not fitted with a measuring device; liquid elevators; part thereof:",,,,1,1,MACHINERY
84,8414,841490,Break-Bulk,General Cargo,Vehicles & Machinery,Vehicles & Machine,MACHINERY,0,10000,KEEP,"Air or vacuum pumps, air or other gas compressors and fans; ventilating or recycling hoods incorporating a fan, whether or not fitted with filters; gas-tight biological safety cabinets, whether or not fitted with filters; parts thereof:","Air or vacuum pumps, air or other gas compressors and fans; ventilating or recycling hoods incorporating a fan, whether or not fitted with filters; gas-tight biological safety cabinets, whether or not fitted with filters; parts thereof:",,,,1,1,MACHINERY
84,8415,841582,Break-Bulk,General Cargo,Vehicles & Machinery,Vehicles & Machine,MACHINERY,0,10000,KEEP,"Air conditioning machines, comprising a motor-driven fan and elements for changing the temperature and humidity, including those machines in which the humidity cannot be separately regulated; parts thereof:","Air conditioning machines, comprising a motor-driven fan and elements for changing the temperature and humidity, including those machines in which the humidity cannot be separately regulated; parts thereof:",,,,1,1,MACHINERY
84,8416,841620,Break-Bulk,General Cargo,Vehicles & Machinery,Vehicles & Machine,MACHINERY,0,10000,KEEP,"Furnace burners for liquid fuel, for pulverized solid fuel or for gas; mechanical stokers, including their mechanical grates, mechanical ash dischargers and similar appliances; parts thereof:","Furnace burners for liquid fuel, for pulverized solid fuel or for gas; mechanical stokers, including their mechanical grates, mechanical ash dischargers and similar appliances; parts thereof:",,,,1,1,MACHINERY
84,8417,841790,Break-Bulk,General Cargo,Vehicles & Machinery,Vehicles & Machine,MACHINERY,0,10000,KEEP,"Industrial or laboratory furnaces and ovens, including incinerators, nonelectric, and parts thereof:","Industrial or laboratory furnaces and ovens, including incinerators, nonelectric, and parts thereof:",,,,1,1,MACHINERY
84,8418,841899,Break-Bulk,General Cargo,Vehicles & Machinery,Vehicles & Machine,MACHINERY,0,10000,KEEP,"Refrigerators, freezers and other refrigerating or freezing equipment, electric or other; heat pumps, other than the air conditioning machines of heading 8415; parts thereof:","Refrigerators, freezers and other refrigerating or freezing equipment, electric or other; heat pumps, other than the air conditioning machines of heading 8415; parts thereof:",,,,1,1,MACHINERY
84,8419,841950,Break-Bulk,General Cargo,Vehicles & Machinery,Vehicles & Machine,MACHINERY,0,10000,KEEP,"Machinery, plant or laboratory equipment, whether or not electrically heated (excluding furnaces, ovens and other equipment of heading 8514), for the treatment of materials by a process involving a change of temperature such as heating, cooking, roasting, distilling, rectifying, sterilizing, pasteurizing, steaming, drying, evaporating, vaporizing, condensing or cooling, other than machinery or plant of a kind used for domestic purposes; instantaneous or storage water heaters, nonelectric; parts thereof:","Machinery, plant or laboratory equipment, whether or not electrically heated (excluding furnaces, ovens and other equipment of heading 8514), for the treatment of materials by a process involving a change of temperature such as heating, cooking, roasting, distilling, rectifying, sterilizing, pasteurizing, steaming, drying, evaporating, vaporizing, condensing or cooling, other than machinery or plant of a kind used for domestic purposes; instantaneous or storage water heaters, nonelectric; parts thereof:",,,,1,1,MACHINERY
84,8420,842084,Break-Bulk,General Cargo,Vehicles & Machinery,Vehicles & Machine,MACHINERY,0,10000,KEEP,"Calendering or other rolling machines, other than for metals or glass, and cylinders therefor; parts thereof:","Calendering or other rolling machines, other than for metals or glass, and cylinders therefor; parts thereof:",,,,1,1,MACHINERY
84,8421,842121,Break-Bulk,General Cargo,Vehicles & Machinery,Vehicles & Machine,MACHINERY,0,10000,KEEP,"Centrifuges, including centrifugal dryers; filtering or purifying machinery and apparatus, for liquids or gases; parts thereof:","Centrifuges, including centrifugal dryers; filtering or purifying machinery and apparatus, for liquids or gases; parts thereof:",,,,1,1,MACHINERY
84,8422,842230,Break-Bulk,General Cargo,Vehicles & Machinery,Vehicles & Machine,MACHINERY,0,10000,KEEP,"Dishwashing machines; machinery for cleaning or drying bottles or other containers; machinery for filling, closing, sealing or labeling bottles, cans, boxes, bags or other containers; machinery for capsuling bottles, jars, tubes and similar containers; other packing or wrapping machinery (including heat-shrink wrapping machinery); machinery for aerating beverages; parts thereof:","Dishwashing machines; machinery for cleaning or drying bottles or other containers; machinery for filling, closing, sealing or labeling bottles, cans, boxes, bags or other containers; machinery for capsuling bottles, jars, tubes and similar containers; other packing or wrapping machinery (including heat-shrink wrapping machinery); machinery for aerating beverages; parts thereof:",,,,1,1,MACHINERY
84,8423,842390,Break-Bulk,General Cargo,Vehicles & Machinery,Vehicles & Machine,MACHINERY,0,10000,KEEP,"Weighing machinery (excluding balances of a sensitivity of 5 cg or better), including weight-operated counting or checking machines; weighing machine weights of all kinds; parts of weighing machinery:","Weighing machinery (excluding balances of a sensitivity of 5 cg or better), including weight-operated counting or checking machines; weighing machine weights of all kinds; parts of weighing machinery:",,,,1,1,MACHINERY
84,8424,842489,Break-Bulk,General Cargo,Vehicles & Machinery,Vehicles & Machine,MACHINERY,0,10000,KEEP,"Mechanical appliances (whether or not hand operated) for projecting, dispersing or spraying liquids or powders; fire extinguishers, whether or not charged; spray guns and similar appliances; steam or sand blasting machines and similar jet projecting machines; parts thereof:","Mechanical appliances (whether or not hand operated) for projecting, dispersing or spraying liquids or powders; fire extinguishers, whether or not charged; spray guns and similar appliances; steam or sand blasting machines and similar jet projecting machines; parts thereof:",,,,1,1,MACHINERY
84,8425,008425,Break-Bulk,General Cargo,Vehicles & Machinery,Vehicles & Machine,MACHINERY,0,10000,KEEP,Pulley tackle and hoists other than skip hoists; winches and capstans; jacks:,Pulley tackle and hoists other than skip hoists; winches and capstans; jacks:,,,,1,1,MACHINERY
84,8426,842641,Break-Bulk,General Cargo,Vehicles & Machinery,Vehicles & Machine,MACHINERY,0,10000,KEEP,"Ships' derricks; cranes, including cable cranes; mobile lifting frames, straddle carriers and works trucks fitted with a crane:","Ships' derricks; cranes, including cable cranes; mobile lifting frames, straddle carriers and works trucks fitted with a crane:",,,,1,1,MACHINERY
84,8427,842720,Break-Bulk,General Cargo,Vehicles & Machinery,Vehicles & Machine,MACHINERY,0,10000,KEEP,Fork-lift trucks; other works trucks fitted with lifting or handling equipment:,Fork-lift trucks; other works trucks fitted with lifting or handling equipment:,,,,1,1,MACHINERY
84,8428,842890,Break-Bulk,General Cargo,Vehicles & Machinery,Vehicles & Machine,MACHINERY,0,10000,KEEP,"Other lifting, handling, loading or unloading machinery (for example, elevators, escalators, conveyors, teleferics):","Other lifting, handling, loading or unloading machinery (for example, elevators, escalators, conveyors, teleferics):",,,,1,1,MACHINERY
